samples/snapshots/normal/hourlypayroll.json

{
  "descriptor" : {
    "meta" : [ ],
    "name" : "Hourly payroll: weekly net pay"
  },
  "variables" : [ {
    "track" : {
      "createdAt" : "2026-08-05T08:19:32.9268758Z",
      "descriptor" : {
        "meta" : [ ],
        "name" : "Computation precision (DECIMAL64)"
      },
      "id" : "i_1",
      "kind" : "INPUT",
      "numericId" : 1,
      "valueClass" : "java.math.MathContext"
    },
    "value" : {
      "precision" : 16,
      "roundingMode" : "HALF_EVEN"
    }
  }, {
    "track" : {
      "createdAt" : "2026-08-05T08:19:32.9268758Z",
      "descriptor" : {
        "meta" : [ ],
        "name" : "Base hourly rate"
      },
      "id" : "i_2",
      "kind" : "INPUT",
      "numericId" : 2,
      "valueClass" : "java.math.BigDecimal"
    },
    "value" : "22.00"
  }, {
    "track" : {
      "createdAt" : "2026-08-05T08:19:32.9268758Z",
      "descriptor" : {
        "meta" : [ ],
        "name" : "Regular hours"
      },
      "id" : "i_3",
      "kind" : "INPUT",
      "numericId" : 3,
      "valueClass" : "java.math.BigDecimal"
    },
    "value" : "40"
  }, {
    "track" : {
      "createdAt" : "2026-08-05T08:19:32.9268758Z",
      "descriptor" : {
        "meta" : [ ],
        "name" : "Regular pay"
      },
      "id" : "o_4",
      "kind" : "OUTPUT",
      "numericId" : 4,
      "valueClass" : "java.math.BigDecimal"
    },
    "value" : "880.00"
  }, {
    "track" : {
      "createdAt" : "2026-08-05T08:19:32.9268758Z",
      "descriptor" : {
        "meta" : [ ],
        "name" : "Overtime hours"
      },
      "id" : "i_5",
      "kind" : "INPUT",
      "numericId" : 5,
      "valueClass" : "java.math.BigDecimal"
    },
    "value" : "6"
  }, {
    "track" : {
      "createdAt" : "2026-08-05T08:19:32.9268758Z",
      "descriptor" : {
        "meta" : [ ],
        "name" : "Overtime multiplier (1.5x)"
      },
      "id" : "i_6",
      "kind" : "INPUT",
      "numericId" : 6,
      "valueClass" : "java.math.BigDecimal"
    },
    "value" : "1.5"
  }, {
    "track" : {
      "createdAt" : "2026-08-05T08:19:32.9268758Z",
      "descriptor" : {
        "meta" : [ ],
        "name" : "Overtime rate"
      },
      "id" : "o_7",
      "kind" : "OUTPUT",
      "numericId" : 7,
      "valueClass" : "java.math.BigDecimal"
    },
    "value" : "33.000"
  }, {
    "track" : {
      "createdAt" : "2026-08-05T08:19:32.9268758Z",
      "descriptor" : {
        "meta" : [ ],
        "name" : "Overtime pay"
      },
      "id" : "o_8",
      "kind" : "OUTPUT",
      "numericId" : 8,
      "valueClass" : "java.math.BigDecimal"
    },
    "value" : "198.000"
  }, {
    "track" : {
      "createdAt" : "2026-08-05T08:19:32.9268758Z",
      "descriptor" : {
        "meta" : [ ],
        "name" : "Night-shift hours"
      },
      "id" : "i_9",
      "kind" : "INPUT",
      "numericId" : 9,
      "valueClass" : "java.math.BigDecimal"
    },
    "value" : "12"
  }, {
    "track" : {
      "createdAt" : "2026-08-05T08:19:32.9268758Z",
      "descriptor" : {
        "meta" : [ ],
        "name" : "Night-shift differential ($\/hr)"
      },
      "id" : "i_10",
      "kind" : "INPUT",
      "numericId" : 10,
      "valueClass" : "java.math.BigDecimal"
    },
    "value" : "1.75"
  }, {
    "track" : {
      "createdAt" : "2026-08-05T08:19:32.9268758Z",
      "descriptor" : {
        "meta" : [ ],
        "name" : "Night-shift differential pay"
      },
      "id" : "o_11",
      "kind" : "OUTPUT",
      "numericId" : 11,
      "valueClass" : "java.math.BigDecimal"
    },
    "value" : "21.00"
  }, {
    "track" : {
      "createdAt" : "2026-08-05T08:19:32.9268758Z",
      "descriptor" : {
        "meta" : [ ],
        "name" : "Gross pay"
      },
      "id" : "o_12",
      "kind" : "OUTPUT",
      "numericId" : 12,
      "valueClass" : "java.math.BigDecimal"
    },
    "value" : "1099.000"
  }, {
    "track" : {
      "createdAt" : "2026-08-05T08:19:32.9268758Z",
      "descriptor" : {
        "meta" : [ ],
        "name" : "Payroll tax withholding rate (18%)"
      },
      "id" : "i_13",
      "kind" : "INPUT",
      "numericId" : 13,
      "valueClass" : "java.math.BigDecimal"
    },
    "value" : "0.18"
  }, {
    "track" : {
      "createdAt" : "2026-08-05T08:19:32.9268758Z",
      "descriptor" : {
        "meta" : [ ],
        "name" : "Payroll tax withholding"
      },
      "id" : "o_14",
      "kind" : "OUTPUT",
      "numericId" : 14,
      "valueClass" : "java.math.BigDecimal"
    },
    "value" : "197.82000"
  }, {
    "track" : {
      "createdAt" : "2026-08-05T08:19:32.9268758Z",
      "descriptor" : {
        "meta" : [ ],
        "name" : "Net pay"
      },
      "id" : "o_15",
      "kind" : "OUTPUT",
      "numericId" : 15,
      "valueClass" : "java.math.BigDecimal"
    },
    "value" : "901.18000"
  } ],
  "operations" : [ {
    "track" : {
      "descriptor" : {
        "meta" : [ {
          "key" : "formula",
          "value" : "(a*b)mc"
        } ],
        "name" : "multiply"
      },
      "finishedAt" : "2026-08-05T08:19:32.9268758Z",
      "id" : "op_1",
      "numericId" : 1,
      "startedAt" : "2026-08-05T08:19:32.9268758Z",
      "wrapperClass" : "io.compprov.core.wrappers.WrappedBigDecimal"
    },
    "arguments" : [ {
      "key" : "a",
      "value" : "i_3"
    }, {
      "key" : "b",
      "value" : "i_2"
    }, {
      "key" : "mc",
      "value" : "i_1"
    } ],
    "resultId" : "o_4"
  }, {
    "track" : {
      "descriptor" : {
        "meta" : [ {
          "key" : "formula",
          "value" : "(a*b)mc"
        } ],
        "name" : "multiply"
      },
      "finishedAt" : "2026-08-05T08:19:32.9268758Z",
      "id" : "op_2",
      "numericId" : 2,
      "startedAt" : "2026-08-05T08:19:32.9268758Z",
      "wrapperClass" : "io.compprov.core.wrappers.WrappedBigDecimal"
    },
    "arguments" : [ {
      "key" : "a",
      "value" : "i_2"
    }, {
      "key" : "b",
      "value" : "i_6"
    }, {
      "key" : "mc",
      "value" : "i_1"
    } ],
    "resultId" : "o_7"
  }, {
    "track" : {
      "descriptor" : {
        "meta" : [ {
          "key" : "formula",
          "value" : "(a*b)mc"
        } ],
        "name" : "multiply"
      },
      "finishedAt" : "2026-08-05T08:19:32.9268758Z",
      "id" : "op_3",
      "numericId" : 3,
      "startedAt" : "2026-08-05T08:19:32.9268758Z",
      "wrapperClass" : "io.compprov.core.wrappers.WrappedBigDecimal"
    },
    "arguments" : [ {
      "key" : "a",
      "value" : "i_5"
    }, {
      "key" : "b",
      "value" : "o_7"
    }, {
      "key" : "mc",
      "value" : "i_1"
    } ],
    "resultId" : "o_8"
  }, {
    "track" : {
      "descriptor" : {
        "meta" : [ {
          "key" : "formula",
          "value" : "(a*b)mc"
        } ],
        "name" : "multiply"
      },
      "finishedAt" : "2026-08-05T08:19:32.9268758Z",
      "id" : "op_4",
      "numericId" : 4,
      "startedAt" : "2026-08-05T08:19:32.9268758Z",
      "wrapperClass" : "io.compprov.core.wrappers.WrappedBigDecimal"
    },
    "arguments" : [ {
      "key" : "a",
      "value" : "i_9"
    }, {
      "key" : "b",
      "value" : "i_10"
    }, {
      "key" : "mc",
      "value" : "i_1"
    } ],
    "resultId" : "o_11"
  }, {
    "track" : {
      "descriptor" : {
        "meta" : [ {
          "key" : "formula",
          "value" : "(a+b0+...+bn)mc"
        } ],
        "name" : "addBulk"
      },
      "finishedAt" : "2026-08-05T08:19:32.9268758Z",
      "id" : "op_5",
      "numericId" : 5,
      "startedAt" : "2026-08-05T08:19:32.9268758Z",
      "wrapperClass" : "io.compprov.core.wrappers.WrappedBigDecimal"
    },
    "arguments" : [ {
      "key" : "a",
      "value" : "o_4"
    }, {
      "key" : "b0",
      "value" : "o_8"
    }, {
      "key" : "b1",
      "value" : "o_11"
    }, {
      "key" : "mc",
      "value" : "i_1"
    } ],
    "resultId" : "o_12"
  }, {
    "track" : {
      "descriptor" : {
        "meta" : [ {
          "key" : "formula",
          "value" : "(a*b)mc"
        } ],
        "name" : "multiply"
      },
      "finishedAt" : "2026-08-05T08:19:32.9268758Z",
      "id" : "op_6",
      "numericId" : 6,
      "startedAt" : "2026-08-05T08:19:32.9268758Z",
      "wrapperClass" : "io.compprov.core.wrappers.WrappedBigDecimal"
    },
    "arguments" : [ {
      "key" : "a",
      "value" : "o_12"
    }, {
      "key" : "b",
      "value" : "i_13"
    }, {
      "key" : "mc",
      "value" : "i_1"
    } ],
    "resultId" : "o_14"
  }, {
    "track" : {
      "descriptor" : {
        "meta" : [ {
          "key" : "formula",
          "value" : "(a-b)mc"
        } ],
        "name" : "subtract"
      },
      "finishedAt" : "2026-08-05T08:19:32.9268758Z",
      "id" : "op_7",
      "numericId" : 7,
      "startedAt" : "2026-08-05T08:19:32.9268758Z",
      "wrapperClass" : "io.compprov.core.wrappers.WrappedBigDecimal"
    },
    "arguments" : [ {
      "key" : "a",
      "value" : "o_12"
    }, {
      "key" : "b",
      "value" : "o_14"
    }, {
      "key" : "mc",
      "value" : "i_1"
    } ],
    "resultId" : "o_15"
  } ]
}

samples/outputs/llm-api/claude-sonnet-5/single_prompt/2026-11-03_20-22-55.586/out/93_hourlypayroll.json/single_prompt_user_prompt.md

## CPG

<CPG>
{
"version" : "1.0",
"descriptor" : {
"meta" : [ ],
"name" : "Hourly payroll: weekly net pay"
},
"variables" : [ {
"track" : {
"descriptor" : {
"meta" : [ ],
"name" : "Computation precision (DECIMAL64)"
},
"id" : "i_1",
"valueClass" : "java.math.MathContext"
},
"value" : {
"precision" : 16,
"roundingMode" : "HALF_EVEN"
}
}, {
"track" : {
"descriptor" : {
"meta" : [ ],
"name" : "Base hourly rate"
},
"id" : "i_2",
"valueClass" : "java.math.BigDecimal"
},
"value" : "22.00"
}, {
"track" : {
"descriptor" : {
"meta" : [ ],
"name" : "Regular hours"
},
"id" : "i_3",
"valueClass" : "java.math.BigDecimal"
},
"value" : "40"
}, {
"track" : {
"descriptor" : {
"meta" : [ ],
"name" : "Regular pay"
},
"id" : "o_4",
"valueClass" : "java.math.BigDecimal"
},
"value" : "880.00"
}, {
"track" : {
"descriptor" : {
"meta" : [ ],
"name" : "Overtime hours"
},
"id" : "i_5",
"valueClass" : "java.math.BigDecimal"
},
"value" : "6"
}, {
"track" : {
"descriptor" : {
"meta" : [ ],
"name" : "Overtime multiplier (1.5x)"
},
"id" : "i_6",
"valueClass" : "java.math.BigDecimal"
},
"value" : "1.5"
}, {
"track" : {
"descriptor" : {
"meta" : [ ],
"name" : "Overtime rate"
},
"id" : "o_7",
"valueClass" : "java.math.BigDecimal"
},
"value" : "33.000"
}, {
"track" : {
"descriptor" : {
"meta" : [ ],
"name" : "Overtime pay"
},
"id" : "o_8",
"valueClass" : "java.math.BigDecimal"
},
"value" : "198.000"
}, {
"track" : {
"descriptor" : {
"meta" : [ ],
"name" : "Night-shift hours"
},
"id" : "i_9",
"valueClass" : "java.math.BigDecimal"
},
"value" : "12"
}, {
"track" : {
"descriptor" : {
"meta" : [ ],
"name" : "Night-shift differential ($/hr)"
},
"id" : "i_10",
"valueClass" : "java.math.BigDecimal"
},
"value" : "1.75"
}, {
"track" : {
"descriptor" : {
"meta" : [ ],
"name" : "Night-shift differential pay"
},
"id" : "o_11",
"valueClass" : "java.math.BigDecimal"
},
"value" : "21.00"
}, {
"track" : {
"descriptor" : {
"meta" : [ ],
"name" : "Gross pay"
},
"id" : "o_12",
"valueClass" : "java.math.BigDecimal"
},
"value" : "1099.000"
}, {
"track" : {
"descriptor" : {
"meta" : [ ],
"name" : "Payroll tax withholding rate (18%)"
},
"id" : "i_13",
"valueClass" : "java.math.BigDecimal"
},
"value" : "0.18"
}, {
"track" : {
"descriptor" : {
"meta" : [ ],
"name" : "Payroll tax withholding"
},
"id" : "o_14",
"valueClass" : "java.math.BigDecimal"
},
"value" : "197.82000"
}, {
"track" : {
"descriptor" : {
"meta" : [ ],
"name" : "Net pay"
},
"id" : "o_15",
"valueClass" : "java.math.BigDecimal"
},
"value" : "901.18000"
} ],
"operations" : [ {
"track" : {
"descriptor" : {
"meta" : [ {
"key" : "formula",
"value" : "(a*b)mc"
} ],
"name" : "multiply"
},
"id" : "op_1",
"wrapperClass" : "io.compprov.core.wrappers.WrappedBigDecimal"
},
"arguments" : [ {
"key" : "a",
"value" : "i_3"
}, {
"key" : "b",
"value" : "i_2"
}, {
"key" : "mc",
"value" : "i_1"
} ],
"resultId" : "o_4"
}, {
"track" : {
"descriptor" : {
"meta" : [ {
"key" : "formula",
"value" : "(a*b)mc"
} ],
"name" : "multiply"
},
"id" : "op_2",
"wrapperClass" : "io.compprov.core.wrappers.WrappedBigDecimal"
},
"arguments" : [ {
"key" : "a",
"value" : "i_2"
}, {
"key" : "b",
"value" : "i_6"
}, {
"key" : "mc",
"value" : "i_1"
} ],
"resultId" : "o_7"
}, {
"track" : {
"descriptor" : {
"meta" : [ {
"key" : "formula",
"value" : "(a*b)mc"
} ],
"name" : "multiply"
},
"id" : "op_3",
"wrapperClass" : "io.compprov.core.wrappers.WrappedBigDecimal"
},
"arguments" : [ {
"key" : "a",
"value" : "i_5"
}, {
"key" : "b",
"value" : "o_7"
}, {
"key" : "mc",
"value" : "i_1"
} ],
"resultId" : "o_8"
}, {
"track" : {
"descriptor" : {
"meta" : [ {
"key" : "formula",
"value" : "(a*b)mc"
} ],
"name" : "multiply"
},
"id" : "op_4",
"wrapperClass" : "io.compprov.core.wrappers.WrappedBigDecimal"
},
"arguments" : [ {
"key" : "a",
"value" : "i_9"
}, {
"key" : "b",
"value" : "i_10"
}, {
"key" : "mc",
"value" : "i_1"
} ],
"resultId" : "o_11"
}, {
"track" : {
"descriptor" : {
"meta" : [ {
"key" : "formula",
"value" : "(a+b0+...+bn)mc"
} ],
"name" : "addBulk"
},
"id" : "op_5",
"wrapperClass" : "io.compprov.core.wrappers.WrappedBigDecimal"
},
"arguments" : [ {
"key" : "a",
"value" : "o_4"
}, {
"key" : "b0",
"value" : "o_8"
}, {
"key" : "b1",
"value" : "o_11"
}, {
"key" : "mc",
"value" : "i_1"
} ],
"resultId" : "o_12"
}, {
"track" : {
"descriptor" : {
"meta" : [ {
"key" : "formula",
"value" : "(a*b)mc"
} ],
"name" : "multiply"
},
"id" : "op_6",
"wrapperClass" : "io.compprov.core.wrappers.WrappedBigDecimal"
},
"arguments" : [ {
"key" : "a",
"value" : "o_12"
}, {
"key" : "b",
"value" : "i_13"
}, {
"key" : "mc",
"value" : "i_1"
} ],
"resultId" : "o_14"
}, {
"track" : {
"descriptor" : {
"meta" : [ {
"key" : "formula",
"value" : "(a-b)mc"
} ],
"name" : "subtract"
},
"id" : "op_7",
"wrapperClass" : "io.compprov.core.wrappers.WrappedBigDecimal"
},
"arguments" : [ {
"key" : "a",
"value" : "o_12"
}, {
"key" : "b",
"value" : "o_14"
}, {
"key" : "mc",
"value" : "i_1"
} ],
"resultId" : "o_15"
} ]
}